{
  "$schema": "http://json-schema.org/draft-07/schema#",
  "title": "User",
  "description": "A user profile object",
  "type": "object",
  "required": ["name", "email"],
  "properties": {
    "name": {
      "type": "string",
      "minLength": 1,
      "maxLength": 100,
      "description": "Full name"
    },
    "email": {
      "type": "string",
      "format": "email",
      "description": "Email address"
    },
    "age": {
      "type": "integer",
      "minimum": 0,
      "maximum": 200,
      "description": "Age in years"
    },
    "role": {
      "type": "string",
      "enum": ["admin", "editor", "viewer"],
      "description": "User role"
    },
    "address": {
      "type": "object",
      "properties": {
        "street": { "type": "string" },
        "city": { "type": "string" },
        "zipCode": { "type": "string", "pattern": "^\\d{5}(-\\d{4})?$" },
        "country": { "type": "string", "minLength": 2, "maxLength": 2 }
      },
      "required": ["city", "country"]
    },
    "tags": {
      "type": "array",
      "items": { "type": "string" },
      "uniqueItems": true,
      "maxItems": 10
    },
    "metadata": {
      "type": "object",
      "additionalProperties": { "type": "string" }
    }
  },
  "additionalProperties": false,
  "if": {
    "properties": { "role": { "const": "admin" } }
  },
  "then": {
    "required": ["age"]
  }
}
