{
  "name": "Alice Johnson",
  "email": "alice@example.com",
  "age": 30,
  "role": "admin",
  "address": {
    "street": "123 Main St",
    "city": "Springfield",
    "zipCode": "62701",
    "country": "US"
  },
  "tags": ["engineering", "team-lead"],
  "metadata": {
    "department": "Engineering",
    "location": "Remote"
  }
}
